#@Asim
#Address book

#UC1


mysql> create database AddressBook;
Query OK, 1 row affected (0.05 sec)

mysql> show databases;
+--------------------+
| Database           |
+--------------------+
| addressbook        |
| information_schema |
| mydb               |
| mysql              |
| performance_schema |
| sys                |
+--------------------+
6 rows in set (0.00 sec)

--------------------------------------------------------------------

#UC2

mysql> use addressbook
Database changed
mysql> create table contacts(
    -> id int auto_increment primary key,
    -> first_name varchar (20) not null,
    -> last_name varchar (20) not null,
    -> address varchar (150) not null,
    -> city varchar (20) not null,
    -> state varchar (20) not null,
    -> zip int not null,
    -> phone_number int not null,
    -> email varchar (30) not null);
Query OK, 0 rows affected (1.47 sec)

mysql> desc contacts;
+--------------+--------------+------+-----+---------+----------------+
| Field        | Type         | Null | Key | Default | Extra          |
+--------------+--------------+------+-----+---------+----------------+
| id           | int          | NO   | PRI | NULL    | auto_increment |
| first_name   | varchar(20)  | NO   |     | NULL    |                |
| last_name    | varchar(20)  | NO   |     | NULL    |                |
| address      | varchar(150) | NO   |     | NULL    |                |
| city         | varchar(20)  | NO   |     | NULL    |                |
| state        | varchar(20)  | NO   |     | NULL    |                |
| zip          | int          | NO   |     | NULL    |                |
| phone_number | int          | NO   |     | NULL    |                |
| email        | varchar(30)  | NO   |     | NULL    |                |
+--------------+--------------+------+-----+---------+----------------+
9 rows in set (0.08 sec)

-------------------------------------------------------

#UC3

mysql> insert into contacts(first_name,last_name,address,city,state,zip,phone_number,email) values("Asim","Ahammed","asdf1234","kochi","kerala","123456","90986","asim78998@gmail.com");
Query OK, 1 row affected (0.15 sec)

mysql> select * from contacts;
+----+------------+-----------+----------+-------+--------+--------+--------------+---------------------+
| id | first_name | last_name | address  | city  | state  | zip    | phone_number | email               |
+----+------------+-----------+----------+-------+--------+--------+--------------+---------------------+
|  1 | Asim       | Ahammed   | asdf1234 | kochi | kerala | 123456 |        90986 | asim78998@gmail.com |
+----+------------+-----------+----------+-------+--------+--------+--------------+---------------------+
1 row in set (0.00 sec)



===================================================
#UC4
#edit contact using first_name
===================================================

mysql> update contacts set phone_number="987456123" where first_name="Asim";
Query OK, 1 row affected (0.07 sec)
Rows matched: 1  Changed: 1  Warnings: 0

mysql> select * from contacts;
+----+------------+-----------+----------+-------+--------+--------+--------------+---------------------+
| id | first_name | last_name | address  | city  | state  | zip    | phone_number | email               |
+----+------------+-----------+----------+-------+--------+--------+--------------+---------------------+
|  1 | Asim       | Ahammed   | asdf1234 | kochi | kerala | 123456 |    987456123 | asim78998@gmail.com |
+----+------------+-----------+----------+-------+--------+--------+--------------+---------------------+
1 row in set (0.04 sec)



=================================================
#UC5
#deleting contacts using firstname
=================================================


mysql> insert into contacts(first_name,last_name,address,city,state,zip,phone_number,email) values("Messi","Lionel","aqw4","Barcelona","spain","234536","34586","messi@mail.com");
Query OK, 1 row affected (0.11 sec)

mysql> select * from contacts;
+----+------------+-----------+----------+-----------+--------+--------+--------------+---------------------+
| id | first_name | last_name | address  | city      | state  | zip    | phone_number | email               |
+----+------------+-----------+----------+-----------+--------+--------+--------------+---------------------+
|  1 | Asim       | Ahammed   | asdf1234 | kochi     | kerala | 123456 |    987456123 | asim78998@gmail.com |
|  2 | Messi      | Lionel    | aqw4     | Barcelona | spain  | 234536 |        34586 | messi@mail.com      |
+----+------------+-----------+----------+-----------+--------+--------+--------------+---------------------+
2 rows in set (0.01 sec)

mysql> delete from contacts where first_name="messi";
Query OK, 1 row affected (0.11 sec)

mysql> select * from contacts;
+----+------------+-----------+----------+-------+--------+--------+--------------+---------------------+
| id | first_name | last_name | address  | city  | state  | zip    | phone_number | email               |
+----+------------+-----------+----------+-------+--------+--------+--------------+---------------------+
|  1 | Asim       | Ahammed   | asdf1234 | kochi | kerala | 123456 |    987456123 | asim78998@gmail.com |
+----+------------+-----------+----------+-------+--------+--------+--------------+---------------------+
1 row in set (0.00 sec)


=========================================================
#UC6
retrive firstname using city
=========================================================


mysql> select first_name from contacts where city="kochi";
+------------+
| first_name |
+------------+
| Asim       |
+------------+
1 row in set (0.00 sec)


=============================================================
#UC7
#Size of table by caluculating size of city
=============================================================

mysql> insert into contacts(first_name,last_name,address,city,state,zip,phone_number,email) values("Messi","Lionel","aqw4","Barcelona","spain","234536","34586","messi@mail.com");
Query OK, 1 row affected (0.16 sec)

mysql> insert into contacts(first_name,last_name,address,city,state,zip,phone_number,email) values("sachin","Tendulkar","aqwss4","mumbai","india","23233","334344586","sachinn@mail.com");
Query OK, 1 row affected (0.12 sec)

mysql> select * from contacts;
+----+------------+-----------+----------+-----------+--------+--------+--------------+---------------------+
| id | first_name | last_name | address  | city      | state  | zip    | phone_number | email               |
+----+------------+-----------+----------+-----------+--------+--------+--------------+---------------------+
|  1 | Asim       | Ahammed   | asdf1234 | kochi     | kerala | 123456 |    987456123 | asim78998@gmail.com |
|  3 | Messi      | Lionel    | aqw4     | Barcelona | spain  | 234536 |        34586 | messi@mail.com      |
|  4 | sachin     | Tendulkar | aqwss4   | mumbai    | india  |  23233 |    334344586 | sachinn@mail.com    |
+----+------------+-----------+----------+-----------+--------+--------+--------------+---------------------+
3 rows in set (0.00 sec)

mysql> select count(city) from contacts;
+-------------+
| count(city) |
+-------------+
|           3 |
+-------------+
1 row in set (0.00 sec)



=====================================================
#UC8
#sorted alphabetically by first_name for a given city
======================================================

mysql> insert into contacts(first_name,last_name,address,city,state,zip,phone_number,email) values("Joy","Tribiyoni","as4","mumbai","india","23233","3345677886","joyn@mail.com");
Query OK, 1 row affected (0.06 sec)

mysql> select * from contacts where city="mumbai" order by first_name asc;
+----+------------+-----------+---------+--------+-------+-------+--------------+------------------+
| id | first_name | last_name | address | city   | state | zip   | phone_number | email            |
+----+------------+-----------+---------+--------+-------+-------+--------------+------------------+
|  6 | Joy        | Tribiyoni | as4     | mumbai | india | 23233 |   3345677886 | joyn@mail.com    |
|  4 | sachin     | Tendulkar | aqwss4  | mumbai | india | 23233 |    334344586 | sachinn@mail.com |
+----+------------+-----------+---------+--------+-------+-------+--------------+------------------+
2 rows in set (0.06 sec)



============================================================
#UC9
#add new column type
============================================================


mysql> alter table contacts add type varchar (20) after id;
Query OK, 0 rows affected (1.60 sec)
Records: 0  Duplicates: 0  Warnings: 0

mysql> select * from contacts;
+----+------+------------+-----------+----------+-----------+--------+--------+--------------+---------------------+
| id | type | first_name | last_name | address  | city      | state  | zip    | phone_number | email               |
+----+------+------------+-----------+----------+-----------+--------+--------+--------------+---------------------+
|  1 | NULL | Asim       | Ahammed   | asdf1234 | kochi     | kerala | 123456 |    987456123 | asim78998@gmail.com |
|  3 | NULL | Messi      | Lionel    | aqw4     | Barcelona | spain  | 234536 |        34586 | messi@mail.com      |
|  4 | NULL | sachin     | Tendulkar | aqwss4   | mumbai    | india  |  23233 |    334344586 | sachinn@mail.com    |
|  6 | NULL | Joy        | Tribiyoni | as4      | mumbai    | india  |  23233 |   3345677886 | joyn@mail.com       |
+----+------+------------+-----------+----------+-----------+--------+--------+--------------+---------------------+
4 rows in set (0.00 sec)

mysql> update contacts set type ="family" where first_name="Asim";
Query OK, 1 row affected (0.12 sec)
Rows matched: 1  Changed: 1  Warnings: 0

mysql> update contacts set type ="friends" where first_name="Messi";
Query OK, 1 row affected (0.12 sec)
Rows matched: 1  Changed: 1  Warnings: 0

mysql> update contacts set type ="friends" where first_name="Sachin";
Query OK, 1 row affected (0.10 sec)
Rows matched: 1  Changed: 1  Warnings: 0

mysql> update contacts set type ="family" where first_name="Joy";
Query OK, 1 row affected (0.04 sec)
Rows matched: 1  Changed: 1  Warnings: 0

mysql> select * from contacts;
+----+---------+------------+-----------+----------+-----------+--------+--------+--------------+---------------------+
| id | type    | first_name | last_name | address  | city      | state  | zip    | phone_number | email               |
+----+---------+------------+-----------+----------+-----------+--------+--------+--------------+---------------------+
|  1 | family  | Asim       | Ahammed   | asdf1234 | kochi     | kerala | 123456 |    987456123 | asim78998@gmail.com |
|  3 | friends | Messi      | Lionel    | aqw4     | Barcelona | spain  | 234536 |        34586 | messi@mail.com      |
|  4 | friends | sachin     | Tendulkar | aqwss4   | mumbai    | india  |  23233 |    334344586 | sachinn@mail.com    |
|  6 | family  | Joy        | Tribiyoni | as4      | mumbai    | india  |  23233 |   3345677886 | joyn@mail.com       |
+----+---------+------------+-----------+----------+-----------+--------+--------+--------------+---------------------+
4 rows in set (0.00 sec)



================================================
#UC10
#count of each type
================================================

mysql> select type, count(type) from contacts group by type;
+---------+-------------+
| type    | count(type) |
+---------+-------------+
| family  |           2 |
| friends |           2 |
+---------+-------------+
2 rows in set (0.05 sec)




==========================================
#UC11
#add one person each for freind adn family
==========================================

mysql> insert into contacts
    -> (type,first_name,last_name,address,city,state,zip,phone_number,email) values
    -> ("family","Aswin","P","thottipalam","kochi","kerala","123456","1234568","aswinp@gmail.com"),
    -> ("friends","Anju","chandren","katil veedu","wayanad","kerala","123","123456789","anju@gmail.com");
Query OK, 2 rows affected (0.09 sec)
Records: 2  Duplicates: 0  Warnings: 0

mysql> select * from contacts;
+----+---------+------------+-----------+-------------+-----------+--------+--------+--------------+---------------------+
| id | type    | first_name | last_name | address     | city      | state  | zip    | phone_number | email               |
+----+---------+------------+-----------+-------------+-----------+--------+--------+--------------+---------------------+
|  1 | family  | Asim       | Ahammed   | asdf1234    | kochi     | kerala | 123456 |    987456123 | asim78998@gmail.com |
|  3 | friends | Messi      | Lionel    | aqw4        | Barcelona | spain  | 234536 |        34586 | messi@mail.com      |
|  4 | friends | sachin     | Tendulkar | aqwss4      | mumbai    | india  |  23233 |    334344586 | sachinn@mail.com    |
|  6 | family  | Joy        | Tribiyoni | as4         | mumbai    | india  |  23233 |   3345677886 | joyn@mail.com       |
|  7 | family  | Aswin      | P         | thottipalam | kochi     | kerala | 123456 |      1234568 | aswinp@gmail.com    |
|  8 | friends | Anju       | chandren  | katil veedu | wayanad   | kerala |    123 |    123456789 | anju@gmail.com      |
+----+---------+------------+-----------+-------------+-----------+--------+--------+--------------+---------------------+
6 rows in set (0.05 sec)


=========================================================
UC12
creating newtable and specifying foregin key
=========================================================
mysql> create table relation_type(
    -> type_id int not null,
    -> type varchar(30) not null,
    -> primary key(type)
    -> );
Query OK, 0 rows affected (2.64 sec)

mysql> insert into relation_type (type_id,type) values
    -> (1,"family"),
    -> (2,"friends");
Query OK, 2 rows affected (0.64 sec)
Records: 2  Duplicates: 0  Warnings: 0

mysql> select * from relation_type;
+---------+---------+
| type_id | type    |
+---------+---------+
|       1 | family  |
|       2 | friends |
+---------+---------+
2 rows in set (0.00 sec)

mysql> alter table contacts add foreign key(type) references relation_type(type);
Query OK, 6 rows affected (3.03 sec)
Records: 6  Duplicates: 0  Warnings: 0

mysql> SELECT * FROM contacts inner join relation_type on contacts.Type = relation_type.Type\G;
*************************** 1. row ***************************
          id: 1
        type: family
  first_name: Asim
   last_name: Ahammed
     address: asdf1234
        city: kochi
       state: kerala
         zip: 123456
phone_number: 987456123
       email: asim78998@gmail.com
     type_id: 1
        type: family
*************************** 2. row ***************************
          id: 6
        type: family
  first_name: Joy
   last_name: Tribiyoni
     address: as4
        city: mumbai
       state: india
         zip: 23233
phone_number: 3345677886
       email: joyn@mail.com
     type_id: 1
        type: family
*************************** 3. row ***************************
          id: 7
        type: family
  first_name: Aswin
   last_name: P
     address: thottipalam
        city: kochi
       state: kerala
         zip: 123456
phone_number: 1234568
       email: aswinp@gmail.com
     type_id: 1
        type: family
*************************** 4. row ***************************
          id: 3
        type: friends
  first_name: Messi
   last_name: Lionel
     address: aqw4
        city: Barcelona
       state: spain
         zip: 234536
phone_number: 34586
       email: messi@mail.com
     type_id: 2
        type: friends
*************************** 5. row ***************************
          id: 4
        type: friends
  first_name: sachin
   last_name: Tendulkar
     address: aqwss4
        city: mumbai
       state: india
         zip: 23233
phone_number: 334344586
       email: sachinn@mail.com
     type_id: 2
        type: friends
*************************** 6. row ***************************
          id: 8
        type: friends
  first_name: Anju
   last_name: chandren
     address: katil veedu
        city: wayanad
       state: kerala
         zip: 12345
phone_number: 123456789
       email: anju@gmail.com
     type_id: 2
        type: friends
6 rows in set (0.04 sec)

ERROR:
No query specified

================================================================
#UC13
#Checking with new table structure
================================================================
