#@Asim
#Address book

#UC1


mysql> create database AddressBook;
Query OK, 1 row affected (0.05 sec)

mysql> show databases;
+--------------------+
| Database           |
+--------------------+
| addressbook        |
| information_schema |
| mydb               |
| mysql              |
| performance_schema |
| sys                |
+--------------------+
6 rows in set (0.00 sec)

--------------------------------------------------------------------

#UC2

mysql> use addressbook
Database changed
mysql> create table contacts(
    -> id int auto_increment primary key,
    -> first_name varchar (20) not null,
    -> last_name varchar (20) not null,
    -> address varchar (150) not null,
    -> city varchar (20) not null,
    -> state varchar (20) not null,
    -> zip int not null,
    -> phone_number int not null,
    -> email varchar (30) not null);
Query OK, 0 rows affected (1.47 sec)

mysql> desc contacts;
+--------------+--------------+------+-----+---------+----------------+
| Field        | Type         | Null | Key | Default | Extra          |
+--------------+--------------+------+-----+---------+----------------+
| id           | int          | NO   | PRI | NULL    | auto_increment |
| first_name   | varchar(20)  | NO   |     | NULL    |                |
| last_name    | varchar(20)  | NO   |     | NULL    |                |
| address      | varchar(150) | NO   |     | NULL    |                |
| city         | varchar(20)  | NO   |     | NULL    |                |
| state        | varchar(20)  | NO   |     | NULL    |                |
| zip          | int          | NO   |     | NULL    |                |
| phone_number | int          | NO   |     | NULL    |                |
| email        | varchar(30)  | NO   |     | NULL    |                |
+--------------+--------------+------+-----+---------+----------------+
9 rows in set (0.08 sec)

-------------------------------------------------------

#UC3

mysql> insert into contacts(first_name,last_name,address,city,state,zip,phone_number,email) values("Asim","Ahammed","asdf1234","kochi","kerala","123456","90986","asim78998@gmail.com");
Query OK, 1 row affected (0.15 sec)

mysql> select * from contacts;
+----+------------+-----------+----------+-------+--------+--------+--------------+---------------------+
| id | first_name | last_name | address  | city  | state  | zip    | phone_number | email               |
+----+------------+-----------+----------+-------+--------+--------+--------------+---------------------+
|  1 | Asim       | Ahammed   | asdf1234 | kochi | kerala | 123456 |        90986 | asim78998@gmail.com |
+----+------------+-----------+----------+-------+--------+--------+--------------+---------------------+
1 row in set (0.00 sec)



===================================================
#UC4
#edit contact using first_name
===================================================

mysql> update contacts set phone_number="987456123" where first_name="Asim";
Query OK, 1 row affected (0.07 sec)
Rows matched: 1  Changed: 1  Warnings: 0

mysql> select * from contacts;
+----+------------+-----------+----------+-------+--------+--------+--------------+---------------------+
| id | first_name | last_name | address  | city  | state  | zip    | phone_number | email               |
+----+------------+-----------+----------+-------+--------+--------+--------------+---------------------+
|  1 | Asim       | Ahammed   | asdf1234 | kochi | kerala | 123456 |    987456123 | asim78998@gmail.com |
+----+------------+-----------+----------+-------+--------+--------+--------------+---------------------+
1 row in set (0.04 sec)



=================================================
#UC5
#deleting contacts using firstname
=================================================


mysql> insert into contacts(first_name,last_name,address,city,state,zip,phone_number,email) values("Messi","Lionel","aqw4","Barcelona","spain","234536","34586","messi@mail.com");
Query OK, 1 row affected (0.11 sec)

mysql> select * from contacts;
+----+------------+-----------+----------+-----------+--------+--------+--------------+---------------------+
| id | first_name | last_name | address  | city      | state  | zip    | phone_number | email               |
+----+------------+-----------+----------+-----------+--------+--------+--------------+---------------------+
|  1 | Asim       | Ahammed   | asdf1234 | kochi     | kerala | 123456 |    987456123 | asim78998@gmail.com |
|  2 | Messi      | Lionel    | aqw4     | Barcelona | spain  | 234536 |        34586 | messi@mail.com      |
+----+------------+-----------+----------+-----------+--------+--------+--------------+---------------------+
2 rows in set (0.01 sec)

mysql> delete from contacts where first_name="messi";
Query OK, 1 row affected (0.11 sec)

mysql> select * from contacts;
+----+------------+-----------+----------+-------+--------+--------+--------------+---------------------+
| id | first_name | last_name | address  | city  | state  | zip    | phone_number | email               |
+----+------------+-----------+----------+-------+--------+--------+--------------+---------------------+
|  1 | Asim       | Ahammed   | asdf1234 | kochi | kerala | 123456 |    987456123 | asim78998@gmail.com |
+----+------------+-----------+----------+-------+--------+--------+--------------+---------------------+
1 row in set (0.00 sec)


=========================================================
#UC6
retrive firstname using city
=========================================================


mysql> select first_name from contacts where city="kochi";
+------------+
| first_name |
+------------+
| Asim       |
+------------+
1 row in set (0.00 sec)


=============================================================
#UC7
#Size of table by caluculating size of city
=============================================================

mysql> insert into contacts(first_name,last_name,address,city,state,zip,phone_number,email) values("Messi","Lionel","aqw4","Barcelona","spain","234536","34586","messi@mail.com");
Query OK, 1 row affected (0.16 sec)

mysql> insert into contacts(first_name,last_name,address,city,state,zip,phone_number,email) values("sachin","Tendulkar","aqwss4","mumbai","india","23233","334344586","sachinn@mail.com");
Query OK, 1 row affected (0.12 sec)

mysql> select * from contacts;
+----+------------+-----------+----------+-----------+--------+--------+--------------+---------------------+
| id | first_name | last_name | address  | city      | state  | zip    | phone_number | email               |
+----+------------+-----------+----------+-----------+--------+--------+--------------+---------------------+
|  1 | Asim       | Ahammed   | asdf1234 | kochi     | kerala | 123456 |    987456123 | asim78998@gmail.com |
|  3 | Messi      | Lionel    | aqw4     | Barcelona | spain  | 234536 |        34586 | messi@mail.com      |
|  4 | sachin     | Tendulkar | aqwss4   | mumbai    | india  |  23233 |    334344586 | sachinn@mail.com    |
+----+------------+-----------+----------+-----------+--------+--------+--------------+---------------------+
3 rows in set (0.00 sec)

mysql> select count(city) from contacts;
+-------------+
| count(city) |
+-------------+
|           3 |
+-------------+
1 row in set (0.00 sec)



=====================================================
#UC8
#sorted alphabetically by first_name for a given city
======================================================

mysql> insert into contacts(first_name,last_name,address,city,state,zip,phone_number,email) values("Joy","Tribiyoni","as4","mumbai","india","23233","3345677886","joyn@mail.com");
Query OK, 1 row affected (0.06 sec)

mysql> select * from contacts where city="mumbai" order by first_name asc;
+----+------------+-----------+---------+--------+-------+-------+--------------+------------------+
| id | first_name | last_name | address | city   | state | zip   | phone_number | email            |
+----+------------+-----------+---------+--------+-------+-------+--------------+------------------+
|  6 | Joy        | Tribiyoni | as4     | mumbai | india | 23233 |   3345677886 | joyn@mail.com    |
|  4 | sachin     | Tendulkar | aqwss4  | mumbai | india | 23233 |    334344586 | sachinn@mail.com |
+----+------------+-----------+---------+--------+-------+-------+--------------+------------------+
2 rows in set (0.06 sec)